,char_img,characters,id,lesson_pos,level,mean_mne,meanings,object,updated,url
11,,父,68,9,3,"There are fins covering the treasure making up this radical. You pull away the fins and start digging where the X is (because ""X"" marks where the treasure is, right?). When you dig down, instead of finding treasure, you find your <radical>father</radical>. The shock of this in your imagination should help you to remember the meaning of this radical!",Father,radical,2020-01-13T20:38:10.586904Z,https://www.wanikani.com/radicals/father
12,,古,69,10,3,"You have a cross on a mouth—that's a pretty religious mouth. Who speaks the most about religion? <radical>Old</radical> people, mostly. Also, think about the teachings of religion itself - also pretty old, age-wise. No matter how you look at it, everything about this radical is kind of ""old.""",Old,radical,2020-01-21T21:39:12.022607Z,https://www.wanikani.com/radicals/old
13,,母,70,0,3,See the <radical>drawer</radical>? It has two shelves in it with a little nubbin handle on each to let you pull them out. Imagine using this drawer - it'd be pretty oddly shaped.,Drawer,radical,2019-12-31T06:03:45.104068Z,https://www.wanikani.com/radicals/drawer-70
14,,用,71,11,3,"This looks a bit like a calendar with spaces for you to write in your <radical>task</radical>s for the day. See those blank sections? Make sure you write down your daily tasks, so you don't forget to do something important!",Task,radical,2020-01-17T19:14:22.065118Z,https://www.wanikani.com/radicals/task
15,,矢,72,12,3,"You have a really big gun. Why? Because only big guns will be able to shoot <radical>arrow</radical>s! Bullets are pretty small, so the guns that shoot them can be any size. But you need a big gun if you want to shove an arrow in it and then shoot it at your enemies.",Arrow,radical,2019-12-31T06:03:45.147815Z,https://www.wanikani.com/radicals/arrow
16,,戸,73,13,3,"Where does a flag usually go? It goes over a <radical>door</radical>. I know the <ja>一</ja> radical usually means ground, but in this case we're going to say the flag is in the doorway (where the <ja>一</ja> is the top of the door).",Door,radical,2019-12-31T06:03:45.167929Z,https://www.wanikani.com/radicals/door
17,,幺,87,14,3,"There's something sticking out of you while you're in private. It's <radical>poop</radical>! You can't just poop in public, that's illegal and gross in this day and age. So the next time something starts to come out of you when you're in private, think, ""Ah yes, it's poop.""",Poop,radical,2019-12-31T06:03:45.486973Z,https://www.wanikani.com/radicals/poop
18,,巾,102,15,3,There's something draped over that stick. It's a <radical>towel!</radical>! Imagine taking a wet towel and hanging it over a railing or a stick so it won't get all musty and gross. It would look just like this.,Towel,radical,2019-12-31T06:03:45.805884Z,https://www.wanikani.com/radicals/towel
19,,生,210,16,3,"This radical consists of a cow radical with the ground radical below it. If you have cows on solid ground, then you really do have a good <radical>life</radical>, I think. Sometimes this radical will show up without the slide part on the side too, though we'll treat them both as ""life.""",Life,radical,2019-12-31T06:03:48.302985Z,https://www.wanikani.com/radicals/life
20,,今,238,17,3,"This is a hat on top of the katakana for ""ra."" Think of Ra, the Egyptian god. When is Ra wearing a hat? Right <radical>now</radical>! It's always now, because he never takes it off. No really, look it up, it's true.",Now,radical,2019-12-31T06:03:48.940833Z,https://www.wanikani.com/radicals/now
21,https://cdn.wanikani.com/images/1105-subject-8764-normal-weight-black-original.png?1520987745,,8764,18,3,Do you know those rice paddy hats? The ones shaped just like this radical? That's why this radical is a <radical>hat</radical>.,Hat,radical,2020-02-09T20:19:46.650404Z,h
22,https://cdn.wanikani.com/images/1114-subject-8765-normal-weight-black-original.png?1520987767,,8765,19,3,"The three horns represent the <radical>triceratops</radical>, one of the most awesome dinosaurs ever.",Triceratops,radical,2019-12-31T06:08:16.506875Z,h
0,,寸,74,0,4,"Have you ever used one of those math compasses? This looks just like one of those because this is the <radical>measurement</radical> radical. Compasses are used to measure things, just like this.",Measurement,radical,2019-12-31T06:03:45.187625Z,https://www.wanikani.com/radicals/measurement
1,,ｲ,75,0,4,"This radical technically means person (like <ja>人</ja>), but we're going to shift the meaning a little bit. It's kind of like the person radical, but it's taller and skinnier, standing above the rest of those peons. That's why this is a <radical>leader</radical>, not a regular old person.",Leader,radical,2020-01-17T20:08:41.044467Z,https://www.wanikani.com/radicals/leader
2,,冖,76,0,4,"Sure, this <radical>forehead</radical> is a bit square, but that's because it's Frankenstein's Monster's forehead. Also, did you notice that this is just the top part of the head (<ja>冂</ja>) radical? This is just the forehead part of that!",Forehead,radical,2019-12-31T06:03:45.235281Z,https://www.wanikani.com/radicals/forehead
3,,也,77,0,4,"See the mouth and teeth of this <radical>alligator</radical>, which is facing to the right? You wouldn't want to get your hand stuck in there, that's for sure.",Alligator,radical,2019-12-31T06:03:45.260371Z,https://www.wanikani.com/radicals/alligator
4,,宀,78,0,4,This is a <radical>roof</radical>. You know it's a roof and not a forehead because there's a little chimney sticking out of the top. And foreheads definitely don't have chimneys.,Roof,radical,2020-01-13T20:30:36.591455Z,https://www.wanikani.com/radicals/roof
5,,弋,79,0,4,"This radical looks like a person with a long dress or train running behind them. That's because it's a bride or groom going to their wedding <radical>ceremony</radical>! You usually have to wear a long dress or a cape if you're at a ceremony. So when you see this radical, think of all the different ceremonies you might have to go to in your life and what you'll need to wear.",Ceremony,radical,2019-12-31T06:03:45.308020Z,https://www.wanikani.com/radicals/ceremony
6,,ネ,80,0,4,"This looks just like the katakana character for ne. Ne for necromancer! That makes this a <radical>spirit</radical>, brought back from the grave. OooooOOoooOoo!",Spirit,radical,2019-12-31T06:03:45.329015Z,https://www.wanikani.com/radicals/spirit
7,,支,81,0,4,"There is a cross growing out of this stool. It's <radical>branch</radical>ing off of it, if you will. The tree that this stool was made of is coming back to life in the form of a branch.",Branch,radical,2019-12-31T06:03:45.355747Z,https://www.wanikani.com/radicals/branch
8,,气,82,0,4,"This radical is shaped kind of like a dam. See the wall and the water pushing over the top? If this radical is a dam, then it must create a ton of <radical>energy</radical> as well!",Energy,radical,2019-12-31T06:03:45.379519Z,https://www.wanikani.com/radicals/energy
9,,世,83,0,4,"There are no circles in kanji, remember? So imagine that these angles are really circles. A little circle in a big circle, with a line running through them. Why, it's the <radical>world</radical>. The world looks just like this, with continents on the globe and a line is the equator. Can you see it?",World,radical,2019-12-31T06:03:45.400386Z,https://www.wanikani.com/radicals/world
10,,皿,84,0,4,This is a few <radical>plate</radical>s drying on a rack. They're stacked together in a line. Imagine reaching out and grabbing one of those plates for yourself.,Plate,radical,2019-12-31T06:03:45.421207Z,https://www.wanikani.com/radicals/plate
11,,竹,85,0,4,"See how tall the stalks are with little bushy things at the top? It kind of looks like <radical>bamboo</radical>, if you use your imagination.",Bamboo,radical,2019-12-31T06:03:45.444191Z,https://www.wanikani.com/radicals/bamboo
12,,糸,86,0,4,"There is something small in some poop. You lean in, carefully pull it out, and realize it's a <radical>thread</radical>. Why is there some thread in this small poop? Because it's cat poop. And cats love to eat thread when you aren't looking. And floss and hoodie strings and mouse tails. But this poop just has thread in it.",Thread,radical,2019-12-31T06:03:45.466089Z,https://www.wanikani.com/radicals/thread
13,,耳,88,0,4,"This radical is a bit more elaborate than the eye, though similar. In fact, if you go blind, your <radical>ear</radical>s become one of your new senses of sight, which is why this is like another, somewhat modified, eye. You'll even notice little lines sticking out of the eye. That's because ears stick out more than eyes (<ja>目</ja>), which is why this radical is the ear radical.",Ear,radical,2019-12-31T06:03:45.507243Z,https://www.wanikani.com/radicals/ear
14,,虫,89,0,4,"There is something private in your mouth. You're keeping it private because you don't want other people to judge you. Why? Because it's an <radical>insect</radical>. You like to eat insects, but society seems to think it's wrong. Don't worry, friend. Someday the rest of the world will embrace eating insects like you have.",Insect,radical,2020-01-17T21:54:39.161233Z,https://www.wanikani.com/radicals/insect
15,,艹,90,0,4,"See the little things sticking out of the ground? Those little things are pretty little <radical>flowers</radical>. You know they're flowers and not, say, grass, because they're spaced out. You'll learn grass later, and it will be less spaced out, but somewhat similar to this, so keep that in mind!",Flowers,radical,2020-02-11T13:58:49.218722Z,https://www.wanikani.com/radicals/flowers
16,,見,91,0,4,"There's an eyeball on top of some legs. When your eyes get taken places (on legs, in this case), your eyes are <radical>see</radical>ing those things. That's why this radical means see.",See,radical,2019-12-31T06:03:45.570878Z,https://www.wanikani.com/radicals/see
17,,赤,92,0,4,"There are some legs and fins under the dirt. Imagine yourself looking at all of these severed limbs... there's blood everywhere. No matter how deep you dig, everything is stained <radical>red</radical>.",Red,radical,2019-12-31T06:03:45.592351Z,https://www.wanikani.com/radicals/red
18,,車,93,0,4,Doesn't this look like a top-down view of the frame of a <radical>car</radical>? There are the rods that make up the base of the car and things for the wheels to go on. That's why this radical is the car radical.,Car,radical,2019-12-31T06:03:45.613831Z,https://www.wanikani.com/radicals/car
19,,貝,94,0,4,"There's a giant eye on top of some fins. Imagine this giant eye to be on top of a clam or a mussel. It has little fins, which it runs around on, escaping from your every attempt to capture it. That's why this is the <radical>shellfish</radical> radical.",Shellfish,radical,2020-02-11T18:42:41.405077Z,https://www.wanikani.com/radicals/shellfish
20,,足,95,0,4,Do you see the dude doing a flying dragon kick to the right? What does he hit the target with? Obviously it's his <radical>foot</radical>.,Foot,radical,2019-12-31T06:03:45.657450Z,https://www.wanikani.com/radicals/foot
21,,不,96,0,4,"If you see this radical in a kanji, you'll want to think of the opposite of whatever other radicals there are. It looks a lot like ""below,"" but guess what? It's <radical>not</radical> the below radical. It's just not.",Not,radical,2019-12-31T06:03:45.677475Z,https://www.wanikani.com/radicals/not
22,,士,97,0,4,"The <radical>samurai</radical> radical looks a lot like the dirt radical. The difference is in the top horizontal line. For samurai, the top is longer because he's holding swords. Dirt can't really hold anything because its arms are too short. So when you see this radical, think: long arms for some long swords. That's a samurai!",Samurai,radical,2019-12-31T06:03:45.699686Z,https://www.wanikani.com/radicals/samurai
23,,米,98,0,4,"Not to be confused with a rice paddy (<ja>田</ja>). This is just raw <radical>rice</radical>, like the grain that grows out of the ground when rice is raw and fresh. When rice is particularly ripe, it'll kind of look like this at the top of the stalks. See the long leaves with the little rice tufts at the top? That's why this radical is ""rice.""",Rice,radical,2019-12-31T06:03:45.724211Z,https://www.wanikani.com/radicals/rice
24,,彳,99,0,4,"The leader (<ja>ｲ</ja>) radical has a little something extra on top of him, holding him down, holding him back. It's causing him to wait... it's causing him to <radical>loiter</radical>.",Loiter,radical,2019-12-31T06:03:45.744643Z,https://www.wanikani.com/radicals/loiter
25,,巴,100,0,4,"You'll have to complete the line on the right side in your mind, but see the rectangle <radical>bed</radical> and the pillows? This is totally a bed. That missing line is where you pulled back the sheets when you got up this morning.",Bed,radical,2019-12-31T06:03:45.766304Z,https://www.wanikani.com/radicals/bed
26,,兀,101,0,4,"Obviously, this looks just like the good ol' 3.14 something-something all people are supposed to learn about. It's the math symbol that has to do with circles... <radical>pi</radical>!",Pi,radical,2019-12-31T06:03:45.785783Z,https://www.wanikani.com/radicals/pi
27,,厂,116,0,4,See the <radical>cliff</radical>? It's facing towards the west. What ocean is to your west? That's the direction this cliff is facing.,Cliff,radical,2019-12-31T06:03:46.181548Z,https://www.wanikani.com/radicals/cliff
28,,主,154,0,4,"This king has a drop of water floating above his head. That's because he's not just a king, he's the <radical>master</radical> of water. Master of elements. Master of ALL THINGS!",Master,radical,2019-12-31T06:03:47.075229Z,https://www.wanikani.com/radicals/master
29,,乚,211,0,4,"Do you know how the bottom of an <radical>umbrella</radical> is shaped? It has a hook that curls around for the handle. So when you see this radical, you should think of the bottom of an umbrella, which will help you remember that it means umbrella.",Umbrella,radical,2019-12-31T06:03:48.324310Z,https://www.wanikani.com/radicals/umbrella
30,https://cdn.wanikani.com/images/1119-subject-8766-normal-weight-black-original.png?1520987779,,8766,0,4,"Doesn't this look like someone on their knees, holding their hands out (clasped) and begging for something (money, their life, etc.)? That's why this radical is known as the <radical>beggar</radical>.",Beggar,radical,2019-12-31T06:08:16.549787Z,h
31,https://cdn.wanikani.com/images/650-subject-8767-without-css-original.svg?1520987250,,8767,0,4,"Can you see the <radical>horns</radical>? You could put these horns on anything. Donkeys, people, monkeys, and so on. That's exactly what we'll be doing when we learn kanji that have horns too.",Horns,radical,2020-01-13T12:31:04.478928Z,h
32,https://cdn.wanikani.com/images/663-subject-8768-without-css-original.svg?1520987253,,8768,0,4,"On the ground there are a bunch of <radical>spikes</radical> coming out. You wouldn't want to step on those now, would you?",Spikes,radical,2020-01-21T22:13:19.831438Z,h
0,,氵,103,0,5,"You've seen one drop (<ja>丶</ja>), but what happens when you triple this and have three drops, which happens to be the maximum number of drops you can have? You end up with a devastating <radical>tsunami</radical>, because there's too much water and nowhere for it to go. Just think of this as a lot of water. When you have a lot of water, you have a tsunami.",Tsunami,radical,2020-02-03T01:29:44.608754Z,https://www.wanikani.com/radicals/tsunami
1,,耂,104,1,5,See the slide going into the dirt? That's where they throw your body when you die. It's actually a <radical>coffin</radical>!,Coffin,radical,2019-12-31T06:03:45.847275Z,https://www.wanikani.com/radicals/coffin
2,,ヨ,105,2,5,"You know <radical>Wolverine</radical> from the X-Men? He has three claws that come out of his hand whenever he needs to fight, not at all unlike the radical you see here.",Wolverine,radical,2019-12-31T06:03:45.868440Z,https://www.wanikani.com/radicals/wolverine
3,,廾,106,3,5,You have <ja>十</ja> plus <ja>十</ja>... what do you get when you add these two kanji together? You get <radical>twenty</radical>.,Twenty,radical,2019-12-31T06:03:45.888880Z,https://www.wanikani.com/radicals/twenty
4,,毋,107,4,5,"See the criss-cross in the pseudo-square shape? That's the frames of a big <radical>window</radical> you can look out of. It's not perfectly shaped like a rice field, it's more artistic. That's why this is a window and <ja>田</ja> is not.",Window,radical,2019-12-31T06:03:45.909249Z,https://www.wanikani.com/radicals/window
5,,肉,108,5,5,"Inside your head, you can only think about people, people, and more people. This is bad, because really all you want is their <radical>meat</radical>, because you're some kind of sick cannibal... you monster. When you think of ""people"" in your head, you're really just thinking about more meat you can eat.",Meat,radical,2019-12-31T06:03:45.929341Z,https://www.wanikani.com/radicals/meat
6,,自,109,6,5,"That little fleck / drop on your eye is what makes you unique. It's what makes you your <radical>self</radical>. It's you, you know?",Self,radical,2019-12-31T06:03:45.950166Z,https://www.wanikani.com/radicals/self
7,,色,110,7,5,"The bed you get in prison is the only thing with <radical>color</radical> you'll see while you're there. Picture a dark, dank cell. Maybe a toilet too. Now picture a bright, colorful bed against the wall. This is the only joy you have.",Color,radical,2019-12-31T06:03:45.970940Z,https://www.wanikani.com/radicals/color
8,,行,111,8,5,"You have the radicals for loiter, two, and barb. Someone who uses two barbs on you while you're loitering really wants you to <radical>GO</radical>!! GO on, stop loitering outside of my convenience store, ya dang kids!",Go,radical,2019-12-31T06:03:45.990431Z,https://www.wanikani.com/radicals/go
9,,西,112,9,5,"You have pi coming out of a mouth. ""3.14,"" it says. We must take the secret of the circle with us, away from here. We must go to a magical place where nobody will persecute us for our math... a place to the <radical>West</radical>!",West,radical,2019-12-31T06:03:46.011167Z,https://www.wanikani.com/radicals/west
10,,可,113,10,5,"There's something hooked going into a mouth. Rather than a hook, though, it's a <radical>lip ring</radical>. They used to use fish hooks and nails in the old days. (Glad we don't live in those times anymore!)",Lip Ring,radical,2019-12-31T06:03:46.032915Z,https://www.wanikani.com/radicals/lip-ring
11,,⻌,114,11,5,This radical is a <radical>scooter</radical>. See the handlebars and the little light? And there's a platform at the bottom you can stand or sit on (if it's one of those nice motorized ones).,Scooter,radical,2020-01-17T19:14:21.965033Z,https://www.wanikani.com/radicals/scooter
12,,斤,115,12,5,"This is a strange looking axe, I know. But think of it this way: the letter ""T"" is in the cliff. What is the ""T""? Of course it has to be Mr. T, who's super awesome. Think of Mr. T wielding a terrifying axe, running after you screaming, ""I pity the fool!"" while trying to chop you down. That makes for a pretty terrifying <radical>axe</radical>.",Axe,radical,2019-12-31T06:03:46.120475Z,https://www.wanikani.com/radicals/axe
13,,言,117,13,5,There are a bunch of sound waves coming out of a mouth. Those waves represent the things you <radical>say</radical>.,Say,radical,2020-02-11T13:58:49.198652Z,https://www.wanikani.com/radicals/say
14,,金,118,14,5,"There's two sets of spikes underneath that hat. It's actually a trap, to prevent anyone from coming in and stealing your <radical>gold</radical>. Why else would you make a trap? Everyone likes to protect their gold.",Gold,radical,2019-12-31T06:03:46.255642Z,https://www.wanikani.com/radicals/gold
15,,雨,119,15,5,The towel is getting soaked with drops of liquid. That's because it's <radical>rain</radical>ing. Get your towels and other clothes inside before they get soaked through from this rain!,Rain,radical,2019-12-31T06:03:46.288193Z,https://www.wanikani.com/radicals/rain
16,,青,120,16,5,"You have life on top of the moon (ignore that life is missing its little slide on the left side). What would life on the moon look like? Well, first of all, they have no air, so they probably look pretty <radical>blue</radical> from asphyxiation. When you meet them, it turns out you're right. They're a civilization of blue people. Imagine them all living up there, being blue and Smurfy.",Blue,radical,2019-12-31T06:03:46.314939Z,https://www.wanikani.com/radicals/blue
17,,冋,121,17,5,See the <radical>mustache</radical> going around the mouth? I wish I could grow a sweet mustache like this.,Mustache,radical,2019-12-31T06:03:46.342302Z,https://www.wanikani.com/radicals/mustache
18,,乍,122,18,5,"This is a very oddly shaped <radical>key</radical>, but it's a key nonetheless.",Key,radical,2019-12-31T06:03:46.363076Z,https://www.wanikani.com/radicals/key
19,,冫,123,19,5,"Remember the radical for drop (of liquid)? This is two drops instead of one. When you see two drops, you should think, ""the next stage of water."" What is the next stage? Why, that is <radical>ice</radical>.",Ice,radical,2019-12-31T06:03:46.384329Z,https://www.wanikani.com/radicals/ice
20,,走,124,20,5,"See the person <radical>run</radical>ning? Don't confuse this with foot (<ja>足</ja>), though. The head is just a streak because this person is running so fast.",Run,radical,2019-12-31T06:03:46.404207Z,https://www.wanikani.com/radicals/run
21,,里,125,21,5,This is a rice paddy with dirt around it. This is the perfect place to set up a <radical>village</radical>. You have a place to farm and some dirt to live on. What else could you need?,Village,radical,2019-12-31T06:03:46.427597Z,https://www.wanikani.com/radicals/village
22,,会,155,22,5,"Under the hat there are two people <radical>meet</radical>ing in private. Look at them huddled up in there. They must have a reason to want to meet in such a private place, but that's not for you to judge. Maybe next time you have to meet with someone you'll hide under a hat with them too.",Meet,radical,2019-12-31T06:03:47.096146Z,https://www.wanikani.com/radicals/meet
23,,开,171,23,5,"Think of an old-style <radical>lantern</radical>. It's on top of a few legs (you can only see two from this angle) and it's in a box shaped holder at the top. You can imagine these lining the streets before electricity, right? That's why this radical is a lantern.",Lantern,radical,2020-01-28T23:20:09.786190Z,https://www.wanikani.com/radicals/lantern
24,,羽,213,24,5,"This radical already looks like a pair of wings, right? What are on wings? Well, usually lots of <radical>feathers</radical>.",Feathers,radical,2019-12-31T06:03:48.366064Z,https://www.wanikani.com/radicals/feathers
25,https://cdn.wanikani.com/images/687-subject-8769-without-css-original.svg?1520987257,,8769,25,5,"This is a roof with extra spikes / horns on it. Who was famous for having spiked roofs, spiked helmets, spiked boats?! The Vikings! That's why this is the <radical>Viking</radical> radical.",Viking,radical,2019-12-31T06:08:16.782152Z,h
26,https://cdn.wanikani.com/images/197-subject-8770-with-css-original.svg?1520987107,,8770,26,5,"These are legs that are bending funny. They're bending so they can <radical>kick</radical> you! Imagine someone doing a flying kick at you. Look at their legs and, ah yes, it looks just like this!",Kick,radical,2019-12-31T06:08:16.810550Z,h
0,,L,56,0,6,"This L-shaped radical is the <radical>lion</radical> radical, because ""L is for Lion."" It also looks like a lion's mouth being opened really, really wide. Imagine a lion opening its mouth to yawn. It looks like this radical!",Lion,radical,2019-12-31T06:03:44.796596Z,https://www.wanikani.com/radicals/lion
1,,凵,127,0,6,"This <radical>box</radical> is open. There could be any number of things inside, but for now all you need to know is the meaning of this radical, which is box.",Box,radical,2019-12-31T06:03:46.468815Z,https://www.wanikani.com/radicals/box
2,,刂,128,0,6,This is a <radical>knife</radical>. See how it has two sharp sides? And there's a little handle at the bottom for the... well the handle. Be careful you don't cut yourself!,Knife,radical,2020-02-10T20:16:35.867531Z,https://www.wanikani.com/radicals/knife
3,,斗,129,0,6,There's a <radical>ladle</radical> scooping up two drops of liquid. See the handle and the scoop part of the ladle? Imagine ladling some water into your mouth. Mmm.,Ladle,radical,2019-12-31T06:03:46.512971Z,https://www.wanikani.com/radicals/ladle
4,,ホ,130,0,6,"First of all, there's a cross making up the middle, which automatically makes this a religion-based radical. That cross is the frame of someone's body and the things coming off of it are wings. This is an <radical>angel</radical>.",Angel,radical,2019-12-31T06:03:46.536521Z,https://www.wanikani.com/radicals/angel
5,,灬,131,0,6,This radical looks like the fire from the burner of a stove or the steam coming up off of a pot of water. That's because this is the <radical>boil</radical> radical. You need to boil a bunch of water over some flames. This radical looks like all of those parts at once!,Boil,radical,2019-12-31T06:03:46.557720Z,https://www.wanikani.com/radicals/boil
6,,歹,132,0,6,"The evening radical is under the ground. Who's doing things underground at night? The <radical>Yakuza</radical>. Picture Yakuza members sneaking around in the subway, or in the sewers. They're definitely up to no good down there.",Yakuza,radical,2020-01-29T01:13:43.660209Z,https://www.wanikani.com/radicals/yakuza
7,,向,133,0,6,"There's a head with a little bit of hair on the top. There's also one big eye in the middle. Only one creature has a head like this, and that creature is the <radical>cyclops</radical>.",Cyclops,radical,2019-12-31T06:03:46.600874Z,https://www.wanikani.com/radicals/cyclops-133
