,char_img,characters,id,lesson_pos,level,mean_mne,meanings,object,updated,url
0,,一,1,0,1,"This radical consists of a single, horizontal stroke. What's the biggest, single, horizontal stroke? That's the <radical>ground</radical>. Look at the ground, look at this radical, now look at the ground again. Kind of the same, right?",Ground,radical,2019-12-31T06:03:43.532468Z,https://www.wanikani.com/radicals/ground
1,,ハ,2,1,1,"Picture a fish. Now picture the fish a little worse, like a child's drawing of the fish. Now erase the fish's body and... you're left with two <radical>fins</radical>! Do you see these two fins? Yeah, you see them.",Fins,radical,2019-12-31T06:03:43.559317Z,https://www.wanikani.com/radicals/fins
2,,丶,3,2,1,"This little radical is a <radical>drop</radical> of water or some other liquid. Notice how it's only one drop? Sometimes radicals or kanji will have more than one drop, so it's important that you know how to tell them apart.",Drop,radical,2020-01-13T20:37:21.900700Z,https://www.wanikani.com/radicals/drop
3,,七,4,14,1,"What does this radical look like? Hmm, nothing much. What about if you turn it upside down? Now does it look like a 7 with a line through it? Close enough to help you to remember that this radical is <radical>seven</radical>, right? Just remember, when you see this radical, flip it over and see what number it looks like. If you can do that, you can remember the meaning!",Seven,radical,2019-12-31T06:03:43.603321Z,https://www.wanikani.com/radicals/seven
4,,丿,5,3,1,"Close your eyes and imagine you're a kid again. Now open them and... look! It's a <radical>slide</radical>! Imagine little you sliding down this slide over and over, having a great time. Imagination + emotion makes for good memorization!",Slide,radical,2020-01-17T21:54:39.146215Z,https://www.wanikani.com/radicals/slide
5,,亅,6,4,1,"This radical is shaped like a <radical>barb</radical>. Like the kind you'd see on barb wire. Imagine one of these getting stuck to your arm or your clothes. Think about how much it would hurt with that little hook on the end sticking into you. Say out loud, ""Oh dang, I got a barb stuck in me!""",Barb,radical,2019-12-31T06:03:43.648607Z,https://www.wanikani.com/radicals/barb
6,,二,7,5,1,"One line plus another line equals <radical>two</radical> lines. This radical represents the number two. Pretty simple, right? Can you guess what three looks like? I bet you can...",Two,radical,2019-12-31T06:03:43.670238Z,https://www.wanikani.com/radicals/two
7,,亠,8,6,1,"This looks like something you'd put on a kettle or a pot, right? It even has a little handle to make sure you don't burn yourself. This is some kind of <radical>lid</radical>.",Lid,radical,2019-12-31T06:03:43.691429Z,https://www.wanikani.com/radicals/lid
8,,人,9,8,1,"If you were to draw a <radical>person</radical> with just strokes like you see in kanji, you'd create a stick figure, maybe something like this: <ja>大</ja>. But this is just a person, not someone holding out their arms to show how big they are. So their arms are down, which makes them look like a torso with a pair of legs. Maybe they're walking too, which is why their legs are spread out like that. You can see the person now, can't you?",Person,radical,2019-12-31T06:03:43.714047Z,https://www.wanikani.com/radicals/person
9,,ト,10,24,1,"This radical looks just like the katakana character <ja>ト</ja> (to), which sounds like the word <radical>toe</radical>. So when you see <ja>ト</ja>, think toe.",Toe,radical,2019-12-31T06:03:43.734857Z,https://www.wanikani.com/radicals/toe
10,,九,11,20,1,"If you look at this radical in just the right way, you'll notice that it kind of looks like the letters ""n"" and ""i"" (the ""i"" comes from the little flippy-up stroke on the right side). What do the letters ""n"" and ""i"" start spelling? Why, the word <radical>nine</radical>.",Nine,radical,2019-12-31T06:03:43.759877Z,https://www.wanikani.com/radicals/nine
11,,入,12,9,1,"Watch out! This isn't the person radical, it's something else. What's the difference? The right side is longer than the left side. And on computers, it usually has that extra part sticking out of the top. It kind of looks like a flap opening to a teepee. And what do you do with an opening? You enter it! That's why this radical is <radical>enter</radical>.",Enter,radical,2019-12-31T06:03:43.783055Z,https://www.wanikani.com/radicals/enter
12,,力,13,10,1,Imagine a guy flexing his arm downward to show off his steroid-pumped arm. It's huge. It's so full of <radical>power</radical>. RARRRWWWRRR!!,Power,radical,2019-12-31T06:03:43.803398Z,https://www.wanikani.com/radicals/power
13,,勹,14,11,1,"This looks like an enclosure of sorts - that's why it's a <radical>prison</radical>. It wraps itself around things and locks them in there. Prisons are pretty scary, even before you imagine one slowly floating down from the sky to trap you.",Prison,radical,2019-12-31T06:03:43.824598Z,https://www.wanikani.com/radicals/prison
14,,十,15,15,1,"This radical looks like a <ja>cross</ja>. I mean, just look at it. Two bars going through each other = a cross!",Cross,radical,2020-01-13T20:23:38.692005Z,https://www.wanikani.com/radicals/cross
15,,口,16,12,1,"A big, gaping, square hole represents someone opening their giant <radical>mouth</radical> to tell you something stupid.",Mouth,radical,2020-01-30T02:16:35.798527Z,https://www.wanikani.com/radicals/mouth
16,,大,18,7,1,"This radical looks just like a stick figure—more specifically, a really <radical>big</radical> guy with his arms stretched out nice and big. When you see this radical, just think big, because this guy is really BIG!",Big,radical,2019-12-31T06:03:43.916474Z,https://www.wanikani.com/radicals/big
17,,女,19,13,1,"This radical looks like a wide person made up of two stacked Xs. Women generally have two XXs for chromosomes, and back in the day they were praised for their wide, child-bearing hips. We may not think of women this way anymore, but way back when Japanese was made, this made them think of a <radical>woman</radical>.",Woman,radical,2020-01-24T00:36:23.776084Z,https://www.wanikani.com/radicals/woman
18,,山,20,16,1,"This is a <radical>mountain</radical>. You'll have to add the lines that make up the top of the mountain if you want it more ""mountain-like."" Also something that might help: sometimes mountains have a couple of smaller peaks coming out the side of the main peak too. Connect the dots and create the mountain in your mind.",Mountain,radical,2019-12-31T06:03:43.961803Z,https://www.wanikani.com/radicals/mountain
19,,川,21,17,1,"This radical already looks like a <radical>river</radical>. See the banks of the river on the side and the flow of the river in the middle? There's even a slight turn in the river too. So when you see this radical, you should think ""river.""",River,radical,2019-12-31T06:03:43.984885Z,https://www.wanikani.com/radicals/river
20,,日,22,23,1,"Since there are no circles in Japanese characters, sometimes rectangles or squares have to make do. In this case, this big rectangle is the <radical>sun</radical>. The middle line going through the center horizontally is the equator. Or maybe it's a cloud, moving across the sun. Picture it, but don't actually look at the sun and burn your eyes!",Sun,radical,2020-01-21T21:40:09.672525Z,https://www.wanikani.com/radicals/sun
21,,木,23,18,1,"Do you see the <radical>tree</radical> in here? It has branches, and then it has the foliage coming down diagonally from it, spreading out like a tree would. That's why this radical is a tree.",Tree,radical,2020-02-10T20:16:35.824995Z,https://www.wanikani.com/radicals/tree
22,,工,25,19,1,"You know those big steel girders that are used for the frame of big buildings? This is like the end of one of those, and have a very distinct shape, just like this radical. These girders are used in construction, which is why this radical means <radical>construction</radical>. Funny thing is, you use these girders to put together buildings just like you're going to use this radical to put together kanji!",Construction,radical,2019-12-31T06:03:44.067443Z,https://www.wanikani.com/radicals/construction
23,https://cdn.wanikani.com/images/110-subject-8761-with-css-original.svg?1520987081,,8761,25,1,"This is a <radical>stick</radical>, sticking out of the ground. It even looks like a stick.",Stick,radical,2019-12-31T06:08:16.350872Z,h
24,https://cdn.wanikani.com/images/1055-subject-8762-normal-weight-black-original.png?1520987608,,8762,22,1,Doesn't this look like a long <radical>gun</radical>? You have a shoulder rest and the barrel. Bam bam bam! Imagine looking down its long barrel at a target. Feel the rest on your shoulder. Now that's a nice gun!,Gun,radical,2019-12-31T06:08:16.405338Z,h
25,https://cdn.wanikani.com/images/1056-subject-8763-normal-weight-black-original.png?1520987610,,8763,21,1,"There's a leaf on top and a stem going down out of it, making it the <radical>leaf</radical> radical. It looks kind of like a lilypad, sitting on top of the water with its stem going down to the bottom where the dirt is.",Leaf,radical,2019-12-31T06:08:16.432311Z,h
0,,土,17,0,2,"There's a cross drawn on the ground, making this <radical>dirt</radical>. You can draw anything in the dirt, it just happens to be a cross this time. Imagine drawing a cross in the dirt with your finger. Feel the dirt get stuck under your fingernail and never forget.",Dirt,radical,2020-01-31T23:45:01.820824Z,https://www.wanikani.com/radicals/dirt
1,,刀,24,1,2,"If you look at this radical, it looks like the bottom part of a <radical>sword</radical>—the handle, more specifically. This radical also looks a lot like the power radical (<ja>力</ja>), so don't get them confused. It's missing the little nubbin at the top, because 90% of the power comes from the sword to cut your enemies down (which is why the sword radical is 90% of the power radical).",Sword,radical,2019-12-31T06:03:44.046535Z,https://www.wanikani.com/radicals/sword
2,,ナ,26,2,2,"This radical looks like the katakana character <ja>ナ</ja> (na), which we're going to say stands for <radical>narwhal</radical>. Plus, this radical kind of looks like a narwhal, right? The body and head on the bottom, and the single majestic narwhal horn coming out the top, shooting up out of the water and into the air. Oh, and don't confuse this radical with treasure. The sideways line for narwhal (<ja>ナ</ja>) is horizontal, the sideways line for treasure is at more of a downward angle (<ja>メ</ja>), like an ""X.""",Narwhal,radical,2019-12-31T06:03:44.092387Z,https://www.wanikani.com/radicals/narwhal
3,,丁,27,3,2,"There's a barb under the ground, holding it in place. This is actually a <radical>street</radical>. All streets have to be secured to the ground with barbs so that they don't slide all over the place. If you tried to pick up the asphalt streets we have today, you'd still find barbs under the ground to keep them there. The more you know! ⭐",Street,radical,2019-12-31T06:03:44.121189Z,https://www.wanikani.com/radicals/street
4,,儿,28,4,2,"This radical already looks like a pair of <radical>legs</radical>. There's even feet on these legs (unlike the fins radical, which you learned earlier). That's how you know these are legs and not fins (or something else).",Legs,radical,2020-01-13T20:39:55.570838Z,https://www.wanikani.com/radicals/legs
5,,冂,29,5,2,"This is the kind of <radical>head</radical> a child might draw—can you imagine it with eyes, nose, mouth, and ears too? Whoever's head this is, it's really square. Maybe it's the head of a famous cartoon spongeman. Hmm.",Head,radical,2020-02-10T20:16:35.846859Z,https://www.wanikani.com/radicals/head
6,,又,30,6,2,"This looks just like a fold-out <radical>stool</radical>, amiright?",Stool,radical,2020-02-11T13:58:49.252210Z,https://www.wanikani.com/radicals/stool
7,,メ,31,7,2,"This radical is <radical>treasure</radical> because ""X marks the spot,"" as they say. Doesn't it look like the X on a pirate treasure map? You want to go find that treasure now, right?!",Treasure,radical,2019-12-31T06:03:44.216937Z,https://www.wanikani.com/radicals/treasure
8,,千,32,8,2,"You're in a room, surrounded by slides. Down off the slides tumble cross after cross after cross. They're bouncing in and hitting you in the face, the arm, everywhere... With each cross comes a voice yelling, ""ONE! TWO! THREE HUNDRED! FIVE HUNDRED!"" and so on. You are worried it will never end, because you're starting to drown in the crosses. Then the voice yells out ONE <radical>THOUSAND</radical> and they stop. Still, you can't move. Think about all the numbers being called out, and keep wondering if it'll be the last one. Feel the relief you'd feel if it stops on a thousand, because you won't be buried anymore. The thousand crosses are covering you entirely, over your head, but because they're crosses you can still breathe.",Thousand,radical,2019-12-31T06:03:44.238039Z,https://www.wanikani.com/radicals/thousand
9,,夕,33,9,2,"Do you see the prison and drop radicals making up this radical? This prison is holding onto a drop because it's the <radical>evening</radical>. Evening air does a better job of holding on to drops of liquid like this, which is why everything is covered in dew in the morning.",Evening,radical,2019-12-31T06:03:44.260875Z,https://www.wanikani.com/radicals/evening
10,,子,34,10,2,"This radical is made up of two barbs and one ground radical. If there are barbs on the ground, whom (especially) do you want to avoid that area? You want your <radical>child</radical> to avoid it, since children are so careless and often don't wear shoes. Imagine how bad you'd feel if you let a child walk around on top of these barbs! Pretty bad, I imagine.",Child,radical,2019-12-31T06:03:44.283741Z,https://www.wanikani.com/radicals/child
11,,小,35,11,2,"You have fins and you have a barb. A fish that you can stick an entire barb through like this would have to be really <radical>small</radical>, since it's sticking through the whole fish body (which you can imagine by basing the body off the size of the fins compared to the already small barb.)",Small,radical,2019-12-31T06:03:44.308644Z,https://www.wanikani.com/radicals/small
12,,弓,36,12,2,This radical looks like a fancy composite <radical>bow</radical> people would use to shoot at targets and definitely not any normal living animals. See how the middle part is being pulled back? Imagine holding this bow and firing it at a target shaped like a giant alligator-crab monster.,Bow,radical,2019-12-31T06:03:44.333486Z,https://www.wanikani.com/radicals/bow
13,,尸,37,13,2,"See the <radical>flag</radical> in this radical? There's a pole with a flag on the end of it, blowing in the wind. Basically, this radical looks just like a flag.",Flag,radical,2020-01-21T21:39:12.004735Z,https://www.wanikani.com/radicals/flag
14,,彡,38,14,2,"These three streaks flowing off to the side are three strands of hair. Pretty easy to see and remember, right?",Hair,radical,2020-02-09T20:19:46.698754Z,https://www.wanikani.com/radicals/hair
15,,五,39,15,2,"If you use your imagination, this radical actually looks like the number ""5."" You have to remove the vertical line in the bottom left, but once you do that, you have an easy way to remember that this radical means <radical>five</radical>.",Five,radical,2019-12-31T06:03:44.407008Z,https://www.wanikani.com/radicals/five
16,,天,40,16,2,"There is a two radical and a person radical. The first level of a person's life is on earth. The second level (this level, which is why there's a two radical here) is in heaven. So when you see a person at level 2, you know they're in <radical>heaven</radical>.",Heaven,radical,2020-01-13T12:31:04.528086Z,https://www.wanikani.com/radicals/heaven
17,,手,41,17,2,"This one's a little tough to picture, but I believe in you. The barb in the middle is the wrist/arm. Then, there are four regular fingers coming off of it and then one big thumb (the slide radical at the top). So you have four fingers, a thumb, and a wrist. This is what makes up your crazy looking <radical>hand</radical>.",Hand,radical,2019-12-31T06:03:44.447472Z,https://www.wanikani.com/radicals/hand
18,,文,42,18,2,"This looks like a stool with a lid on it, but it's actually a <radical>writing</radical> desk. Do you see it? It's a nice, quiet place for writing. You can even see the pen sticking up in the middle. Wouldn't you want to do your writing here?",Writing,radical,2019-12-31T06:03:44.467613Z,https://www.wanikani.com/radicals/writing
19,,月,43,19,2,"The <radical>moon</radical> is actually made of the sun, but it has little legs coming off of it leaning towards the left. Why? Because the moon is always running away from the sun as fast as it can. It doesn't want to get caught on fire, so it has to run to stay ahead!",Moon,radical,2019-12-31T06:03:44.487179Z,https://www.wanikani.com/radicals/moon
20,,止,44,20,2,"There's a giant toe and a stick in the ground in front of you. You're driving your car toward them, but you don't see them until your lights hit them. What would these things cause you to do? Most likely <radical>stop</radical> your car right away.",Stop,radical,2019-12-31T06:03:44.507356Z,https://www.wanikani.com/radicals/stop
21,,水,45,21,2,"There are drops of liquid coming out of both sides of this barb. You can imagine the barb being stuck into the ground then pulled out. When it is, <radical>water</radical> comes gushing out of both sides! That's why this radical is water.",Water,radical,2019-12-31T06:03:44.527120Z,https://www.wanikani.com/radicals/water
22,,火,46,22,2,"See the person radical here? It's got things coming off of it... what are those things—OH MY GOD IT'S <radical>FIRE</radical>!!! Help, help! Put the fire out!",Fire,radical,2019-12-31T06:03:44.547301Z,https://www.wanikani.com/radicals/fire
23,,犬,47,23,2,"Remember the big guy that helped you remember the big radical? Now the big guy has something on his shoulder... what is that? You look and see that he has a <radical>dog</radical> up there, perched as if it were a parrot or a cat or something. Dogs aren't supposed to be up on people's shoulders like that, but for him? It works!",Dog,radical,2019-12-31T06:03:44.567799Z,https://www.wanikani.com/radicals/dog
24,,王,48,24,2,This radical is not something anyone can have. Only a <radical>king</radical> can wear this crown upon his head. This radical is the sign of kings. Imagine your favorite king wearing this on their head. It's a pretty distinctive shape—I think you can do it.,King,radical,2019-12-31T06:03:44.587592Z,https://www.wanikani.com/radicals/king
25,,中,49,25,2,"There's a stick going right through the <radical>middle</radical> of someone's mouth! Imagine that mouth being yours. Measure the placement of the stick. Perfectly aligned, right in the middle. That's amazing, though to be honest, you probably have bigger problems than measuring the location of this stick in your mouth.",Middle,radical,2020-01-17T20:08:41.069073Z,https://www.wanikani.com/radicals/middle
26,,本,50,26,2,There's a cut right at the base of this tree. Why would someone cut down a tree? To make a <radical>book</radical> out of it! Imagine living in the old days when you'd have to cut down a tree yourself to write or read a book.,Book,radical,2019-12-31T06:03:44.625720Z,https://www.wanikani.com/radicals/book
27,,田,51,27,2,Rice paddies are made up of fields with irrigation lines going between them. See the four rice paddies with water flowing between and around them? That's why this radical is <radical>rice paddy</radical>.,Rice Paddy,radical,2019-12-31T06:03:44.645329Z,https://www.wanikani.com/radicals/rice-paddy
28,,白,52,28,2,"Add a drop of the sun to something and it will turn it <radical>white</radical>. The sun is really strong, so even a single drop will burn anything white. Why do you think so many beaches are white? Even the drops of sunblock you use to stop the sun's rays is white. So when you think of sun drops, think white.",White,radical,2019-12-31T06:03:44.665305Z,https://www.wanikani.com/radicals/white
29,,目,53,29,2,"See the iris in the middle of the eyeball? Remember that there are no round things in kanji, so square things take their place. That makes this a pretty realistic, square <radical>eye</radical>. You just have to squint with your real eyes a bit.",Eye,radical,2020-01-17T20:16:52.738560Z,https://www.wanikani.com/radicals/eye
30,,石,54,30,2,"There's a leaf growing out of a square thing (which is normally a mouth, but not this time). The leaf is growing out of a <radical>stone</radical>. I mean, obviously, because leaves don't grow out of mouths. I hope. Anyway, Picture a stone in the middle of nature with a leaf growing out of it or just behind it and you'll never forget this radical!",Stone,radical,2020-01-28T23:20:09.768376Z,https://www.wanikani.com/radicals/stone
31,,立,55,31,2,"Two sticks are propping up a lid. By doing this, they're making it <radical>stand</radical> up.",Stand,radical,2019-12-31T06:03:44.734185Z,https://www.wanikani.com/radicals/stand
32,,牛,126,32,2,"There's a cross and a gun, with the gun going through the cross. You're using the cross to stabilize your gun, because you need to shoot a <radical>cow</radical> for dinner. You bring your cross because you need to bless the cow once you've killed it (and it's also a good stand for your gun). Poor cow.",Cow,radical,2019-12-31T06:03:46.447646Z,https://www.wanikani.com/radicals/cow
33,,ム,140,33,2,"This is a little triangle that's almost completely closed off. When you want to be alone, you hide in a place where you can be in <radical>private</radical>. That's why this is the private radical. You're closing yourself off to the rest of the world, with just a little peephole.",Private,radical,2019-12-31T06:03:46.765807Z,https://www.wanikani.com/radicals/private
0,,匕,57,0,3,"This radical looks like a <radical>spoon</radical>! Well, a spoon that's been bent a lot by an angry person or a psychic. Go grab a spoon and try to bend it into this shape. Then hold on to it so you'll never forget that this is the spoon radical!",Spoon,radical,2020-01-29T01:13:43.677086Z,https://www.wanikani.com/radicals/spoon
1,,ラ,58,0,3,"This radical looks just like the katakana character ""ra"" (ラ). The sound ""ra"" sounds just like the famous Egyptian God ""Ra"" as well, so we're going to say this radical represents Egypt's God <radical>Ra</radical>.",Ra,radical,2019-12-31T06:03:44.840206Z,https://www.wanikani.com/radicals/ra-58
2,,久,59,0,3,This is no ordinary enclosure. It is an enclosure with an extra reinforcement (see it sticking out the bottom right of the enclosure radical?). Why is this enclosure reinforced? Because it's the <radical>raptor cage</radical>. I wonder how long they'll be able to hold the raptors... It didn't work out all that well on Jurassic Park...,Raptor Cage,radical,2019-12-31T06:03:44.869665Z,https://www.wanikani.com/radicals/raptor-cage-59
3,,夂,60,1,3,"This looks kind of like a footprint, but not an ordinary, old footprint. A snowshoe footprint in the snow. Why? Because it's <radical>winter</radical>! And everyone knows the snowshoe footprint is the universal symbol for winter.",Winter,radical,2019-12-31T06:03:44.896687Z,https://www.wanikani.com/radicals/winter
4,,干,61,2,3,"You have two on a stick. Two what? Well, you can't tell because they're too <radical>dry</radical>. Someone put two somethings on this stick to dry, but they seem to have left them out for way too long. Was it meat? Fish? Cucumbers? You have no clue, but they're two very dry somethings, that's for sure.",Dry,radical,2019-12-31T06:03:44.921663Z,https://www.wanikani.com/radicals/dry
5,,广,62,3,3,"This is a <radical>canopy</radical>. See the cloth draping down and the little point at the middle holding it up? You could sit under here and enjoy a bright, summer day without getting any sun!",Canopy,radical,2020-01-17T19:19:11.963659Z,https://www.wanikani.com/radicals/canopy
6,,扌,63,4,3,"This looks like the hand (<ja>手</ja>) radical, but smaller. That's because it's just the <radical>fingers</radical>. You don't always have room for a whole hand to be in a kanji, but there's always space for a few fingers.",Fingers,radical,2020-01-21T21:39:11.985193Z,https://www.wanikani.com/radicals/fingers
7,,元,64,5,3,"You have two and legs making up this radical. Between two legs is where you came from, no matter how you look at it. These two legs are your <radical>origin</radical>.",Origin,radical,2019-12-31T06:03:44.979450Z,https://www.wanikani.com/radicals/origin
8,,心,65,6,3,"Take a good look at this one. It kind of looks like a <radical>heart</radical> (not the stereotypical Valentine’s Day heart, though). Think of a real heart. Basically, there’s a lump (the heart) in the middle, and three lines which make up the arteries that go in and out of the heart to keep you alive. This radical shows up a lot, so it shouldn’t be too hard to learn it as you go along. Remember, lump (heart) plus arteries equals a heart… like, a real heart, not the fake, pretty kind.",Heart,radical,2019-12-31T06:03:44.998765Z,https://www.wanikani.com/radicals/heart
9,,方,66,7,3,This radical looks like a dude running off to the right. He's heading in a very distinct <radical>direction</radical>. Which direction was it again?,Direction,radical,2019-12-31T06:03:45.021454Z,https://www.wanikani.com/radicals/direction
10,,毛,67,8,3,"Do you remember the hair radical? This is like that, except now the hair is attached to a tail. Animals don't usually have hair, though. Instead, they have <radical>fur</radical>.",Fur,radical,2019-12-31T06:03:45.041722Z,https://www.wanikani.com/radicals/fur
