,char_img,characters,id,lesson_pos,level,mean_mne,meanings,object,updated,url
8,,未,134,0,6,"This is like one of those <radical>jet</radical>s that have the little nose-wings going on too. Imagine you're looking at the jet from the top down, this is what it would look like. It's also why this is the jet radical.",Jet,radical,2019-12-31T06:03:46.625235Z,https://www.wanikani.com/radicals/jet
9,,禾,135,0,6,This is a tree with a slide cutting off the top. What do you cut off the top of trees and plants? The <radical>grain</radical>s. Imagine taking a sickle and slicing the grains off rice or wheat. The plant you leave behind will look like this radical. It's a sign that you got a grain of some sort from it.,Grain,radical,2019-12-31T06:03:46.647795Z,https://www.wanikani.com/radicals/grain
10,,羊,136,0,6,This is a <radical>sheep</radical> and you're looking at it from above. See the two ears and the body of the sheep going back (with all its wool poking out to the side) and then the little tail sticking out the back. What a cute sheep!,Sheep,radical,2019-12-31T06:03:46.673672Z,https://www.wanikani.com/radicals/sheep
11,,血,137,0,6,"There's a little speck of something on your plate (<ja>皿</ja>). ""What is that?"" you ask. Oh no... that speck is <radical>BLOOD</radical>!!! I hope it's blood from a nosebleed you suddenly have and not someone else's blood. (Your waiter is probably gonna get fired, btw.) At least your platelets should stop the bleeding soon. Haha, get it? PLATE-lets? Japanese blood jokes.",Blood,radical,2019-12-31T06:03:46.698689Z,https://www.wanikani.com/radicals/blood
12,,長,138,0,6,"You have a modified key radical on top of the kick radical. You kick the key as far as you can, then measure the distance. How <radical>long</radical> did it travel? How long will it take you to find it? How long will you be in trouble for kicking a key into the woods?",Long,radical,2019-12-31T06:03:46.720513Z,https://www.wanikani.com/radicals/long
13,,食,139,0,6,You put on your hat and go outside to kick something white. It's a big white goose and you killed it with your kick. That's because you're going to cook and <radical>eat</radical> it. Yum!,Eat,radical,2019-12-31T06:03:46.741983Z,https://www.wanikani.com/radicals/eat
14,,マ,141,0,6,"This radical is just like the katakana character ""ma"" (<ja>マ</ja>). So let's keep things simple and make the radical <radical>mama</radical>.",Mama,radical,2020-01-17T19:14:22.033467Z,https://www.wanikani.com/radicals/mama
15,,欠,142,0,6,"There's a person in a prison. Why is this person in prison? Because they <radical>lack</radical> the stuff humans need to be around other humans. If you're lacking something (kindness, self-control, etc.) you may do something that makes other people put you in prison. Try to fix what you lack so this won't happen to you.",Lack,radical,2019-12-31T06:03:46.810736Z,https://www.wanikani.com/radicals/lack
16,,占,143,0,6,"Someone has a toe in their mouth. They are a fortune teller telling your <radical>fortune</radical>. But for her to do it, she has to take one of your toes and taste it. This better be a good fortune for you to let someone put your foot in their mouth.",Fortune,radical,2019-12-31T06:03:46.833205Z,https://www.wanikani.com/radicals/fortune
17,,犭,144,0,6,"This looks like a tail with some hairs coming off of it. It shouldn't be confused with fingers though, because it's curved, and the things sticking out are more erratic, like hair or fur would be. That's why this radical is the <radical>animal</radical> radical.",Animal,radical,2019-12-31T06:03:46.858476Z,https://www.wanikani.com/radicals/animal
18,,首,156,0,6,There are some horns on the ground that you want for yourself. You pick them up and you attach them to your <radical>neck</radical>. Imagine these horns sticking out of your neck. No one can slit your throat now that your neck is protected.,Neck,radical,2019-12-31T06:03:47.117582Z,https://www.wanikani.com/radicals/neck
19,,舌,174,0,6,Something is sticking out of a mouth. Something with a thousand little tastebuds on it. It's your <radical>tongue</radical>!,Tongue,radical,2019-12-31T06:03:47.496568Z,https://www.wanikani.com/radicals/tongue
20,,亡,212,0,6,"There's a lid on a lion. And you're stuck under the lid with the lion, which means you will surely meet your <radical>death</radical>. Or if you don't want to die, think of the poor lion. If you leave a lion under a lid for too long, death will come for it too. Either way, somebody's gonna die today.",Death,radical,2019-12-31T06:03:48.345537Z,https://www.wanikani.com/radicals/death
21,,市,267,0,6,"You already learned the kanji 市, which means city. We're treating it as a radical too, since it pops up in many other kanji. When used as a radical, it still means <radical>city</radical>. ",City,radical,2020-02-10T21:48:50.336460Z,https://www.wanikani.com/radicals/city
0,,卩,145,0,7,"This radical looks a little like the letter P, right? It's a P printed onto something... wait, it's not printed, it's a <radical>stamp</radical> that's been put on the paper. Peter Parker likes to use stamps instead of pens.",Stamp,radical,2019-12-31T06:03:46.882788Z,https://www.wanikani.com/radicals/stamp
1,,夫,146,1,7,"The radicals ground and big make up this radical. There's a big guy on the ground... who is that big guy? Embarrassingly, it's your <radical>husband</radical>. Feel the shame that he got knocked down on the ground. By what? Who? How? (It doesn't matter.)",Husband,radical,2019-12-31T06:03:46.903093Z,https://www.wanikani.com/radicals/husband
2,,氏,147,2,7,This looks like a little tamagotchi or (if you aren't a 90s kid) a duck. What do both of these critters have in common? They have really crazy <radical>clan</radical> followings. And the people who enjoy them (tiny pocket games or watching quacking duckies) create clans that get together and share their experiences. Which clan are you a part of?,Clan,radical,2019-12-31T06:03:46.925071Z,https://www.wanikani.com/radicals/clan
3,,矛,148,3,7,"Your mama has been impaled on something! You run toward her and see that she's been impaled on a <radical>spear</radical>. Mama, no!",Spear,radical,2019-12-31T06:03:46.950845Z,https://www.wanikani.com/radicals/spear
4,,舟,149,4,7,This looks like a <radical>boat</radical> coming toward you in the water. See the billowing sail and the reflection off the water? That's what boats look like.,Boat,radical,2019-12-31T06:03:46.972093Z,https://www.wanikani.com/radicals/boat
5,,魚,150,5,7,"In a prison on a rice paddy they're boiling something. What do you think it is? <radical>Fish!</radical>. What goes better with rice? What's easy to find, making it cheap prison food? Fish, of course!",Fish,radical,2019-12-31T06:03:46.992974Z,https://www.wanikani.com/radicals/fish
6,,鳥,151,6,7,See the cool wing on the bottom? See the head with the neat feather coming out of the top? This is a <radical>bird</radical>. Tweet tweet!,Bird,radical,2019-12-31T06:03:47.014113Z,https://www.wanikani.com/radicals/bird
7,,黄,152,7,7,"Flowers that grow out of the ground of a rice paddy after you bury fins there will grow <radical>yellow</radical>. Why? Because yellow is the color of a fish's soul, so planting flowers over their fins will turn them into a nice, pretty yellow. ",Yellow,radical,2020-02-10T22:01:09.350486Z,https://www.wanikani.com/radicals/yellow
8,,黒,153,8,7,"If you boil a village everything will turn <radical>black</radical>. Mostly because you're a crazed murderer, but more so because when you boil a village all the roads melt and coat everything in black tar. Picture it! It looks like Pompeii. (Oof, too soon?)",Black,radical,2019-12-31T06:03:47.054848Z,https://www.wanikani.com/radicals/black
9,,周,169,9,7,"Put some dirt around your head and in your mouth to figure out your head's <radical>circumference</radical>. When you pull your head out you'll have the perfect shape of your head, making measuring the circumference easy. Oh, and the dirt in your mouth? That's just for the taste.",Circumference,radical,2019-12-31T06:03:47.382817Z,https://www.wanikani.com/radicals/circumference
10,,勿,173,10,7,"See the <radical>wing</radical>? It's kind of like a bat wing with webbing. Either way, it's just a wing.",Wing,radical,2019-12-31T06:03:47.476731Z,https://www.wanikani.com/radicals/wing
11,,几,177,11,7,What happens when you put a flat surface on top of a pair of legs? You get a <radical>table</radical>.,Table,radical,2020-01-17T21:54:39.129308Z,https://www.wanikani.com/radicals/table
12,,寺,192,12,7,"This radical looks kind of like a <radical>temple</radical> on a hill, don't you think? With all the layers, n' stuff? Just picture that first horizontal line as the base of the ornate temple balancing on that hill underneath it and you'll have no problem remembering this radical.",Temple,radical,2019-12-31T06:03:47.921064Z,https://www.wanikani.com/radicals/temple
13,,門,214,13,7,"This radical already looks like a <radical>gate</radical>, right? Just imagine a big gate with two pillars, one on either side. Then, up above are the doors, which can come down at any moment.",Gate,radical,2019-12-31T06:03:48.388106Z,https://www.wanikani.com/radicals/gate
14,,己,228,14,7,"This looks a bit like a backwards S. S for Self. But it's backwards because you didn't want to mix yourself up with any of the other selves out there, so you flipped it. That's why it means <radical>oneself</radical>. (That's you!)

This radical will appear as things like yourself, herself, etc., so keep that in mind!",Oneself,radical,2019-12-31T06:03:48.693650Z,https://www.wanikani.com/radicals/oneself
15,,豕,233,15,7,"You have the animal radical in this already, that should be a clue. What kind of animal is it? It's in the ground, covered in mud. Also, there are toes laying around with it, because this animal will eat anything (good way to get rid of bodies... I hear). So what's this animal that's covered in mud and eats toes because it will eat anything? It's a <radical>pig</radical>!",Pig,radical,2019-12-31T06:03:48.803254Z,https://www.wanikani.com/radicals/pig
16,,孝,418,16,7,This radical is made up of coffin and child. To keep a child out of a coffin they'll need a good <radical>teacher</radical> to make sure they know not to stick forks in outlets or dance in traffic. That's why this radical is a teacher.,Teacher,radical,2019-12-31T06:03:53.816231Z,https://www.wanikani.com/radicals/teacher
17,,且,419,17,7,This radical looks just like a top hat. That's why it's <radical>top hat</radical>!,Top Hat,radical,2019-12-31T06:03:53.842381Z,https://www.wanikani.com/radicals/top-hat
0,,ユ,157,0,8,There's a flat line for where the hand was cut off. In it is a <radical>hook</radical> like a pirate might have. Yarrrr.,Hook,radical,2019-12-31T06:03:47.140224Z,https://www.wanikani.com/radicals/hook
1,,巳,158,1,8,"There's two ways to remember this one. First, you could look at this and see it's a coiled up <radical>snake</radical>. Or, if you want, you can imagine it as a snake head, with its face facing to the right (see its open mouth?). We may use either when learning a kanji, but for now you can pick the one that fits best with your memorization style. Just make sure you get to snake when you see this radical.

*Also note that sometimes the coil isn't totally completed (where it connects in the middle of the vertical line).",Snake,radical,2019-12-31T06:03:47.161221Z,https://www.wanikani.com/radicals/snake
2,,云,159,2,8,"This is the radical for <radical>cloud</radical>. See how the cloud is puffy on the bottom but has two lines up top? That's because a plane flew through it. If humans didn't invent planes, this cloud radical might look different. Really makes you think, huh?",Cloud,radical,2019-12-31T06:03:47.181386Z,https://www.wanikani.com/radicals/cloud
3,,殳,160,3,8,"Stick a table on top of a stool and you end up with a very dangerous <radical>weapon</radical>. Imagine hitting someone with this thing! Or, even better, imagine making someone sit on it. They'd be crushed mentally and emotionally and whatnot. Now that's a scary weapon.",Weapon,radical,2019-12-31T06:03:47.201305Z,https://www.wanikani.com/radicals/weapon
4,,比,161,4,8,This radical is made up of two slightly different versions of the spoon radical (which you should already know). Look closely at these two spoons. <radical>Compare</radical> their differences. Like one of those magazines where you compare two similar pictures. But this time it's with spoons.,Compare,radical,2019-12-31T06:03:47.220821Z,https://www.wanikani.com/radicals/compare
5,,罒,163,5,8,"This is a <radical>net</radical>, spread out over the water. Imagine all the fish you can catch in this net!",Net,radical,2020-01-21T21:40:09.693319Z,https://www.wanikani.com/radicals/net
6,,釆,164,6,8,"Most of this radical is just the rice radical, but the top part is something coming to cut the rice from its stalk. That, my friend, is the <radical>sickle</radical>. See how the rice is still there? That's because it's in motion. The sickle is literally doing the cutting RIGHT NOW! (And don't confuse this with the grain <ja>禾</ja> radical!)",Sickle,radical,2019-12-31T06:03:47.281939Z,https://www.wanikani.com/radicals/sickle
7,,馬,165,7,8,"Don't confuse this radical with the bird <ja>鳥</ja> radical. It looks similar, with the wing on the bottom and the shape on top, but it doesn't have a feather sticking out of the top of its head and it has a long, thick neck. So while it moves fast like it has wings, it's no bird, it's a <radical>horse</radical>.",Horse,radical,2020-01-17T19:57:13.106339Z,https://www.wanikani.com/radicals/horse
8,,穴,170,8,8,"You have a roof on top of what looks like a volcano. What is the roof covering on the top of the volcano? Why, it's definitely covering the <radical>hole</radical> at the top. I guess someone thought if they built a roof on the volcano hole, none of the lava could come out.",Hole,radical,2019-12-31T06:03:47.402865Z,https://www.wanikani.com/radicals/hole
9,,易,172,9,8,"If you have wings, flying to the sun will be <radical>easy</radical>. If you try to get there with your wingless, human-body it will not be so easy.",Easy,radical,2019-12-31T06:03:47.452724Z,https://www.wanikani.com/radicals/easy
10,,合,216,10,8,"You find a hat on the ground with a mouth as the design on the front. You think it looks weird, but when you put it on, you find it <radical>suit</radical>s you quite well. Imagine yourself feeling not so sure about this hat at first. But, once you put it on, you feel pleasantly surprised.",Suit,radical,2019-12-31T06:03:48.430497Z,https://www.wanikani.com/radicals/suit
11,,匚,217,11,8,"This radical is a <radical>cage</radical> because it's covered on all sides but one (the one open side is where the cage door or gate is). There's nothing inside this cage because there's no gate, and whatever was inside has gotten out. I hope it wasn't rabid...",Cage,radical,2019-12-31T06:03:48.450815Z,https://www.wanikani.com/radicals/cage
12,https://cdn.wanikani.com/images/1199-subject-8771-normal-weight-black-original.png?1520987974,,8771,12,8,See the rolling <radical>hills</radical> with the road going off into the background to another hill? That's why this is the hills radical.,Hills,radical,2019-12-31T06:08:16.843139Z,h
13,https://cdn.wanikani.com/images/973-subject-8780-normal-weight-black-original.png?1520987373,,8780,13,8,"This is a <radical>cape</radical>, like the kind a superhero would wear. See how it's hanging to the side? Imagine tying it around your neck and running around so it flies behind you.",Cape,radical,2019-12-31T06:08:17.135740Z,h
0,,介,166,0,9,"This radical kind of looks like an arrow, but not an ordinary one. It's curvy and forced, right? Like it's trying to tell you something is being <radical>jammed in</radical> to wherever it's pointing.",Jammed In,radical,2019-12-31T06:03:47.321819Z,https://www.wanikani.com/radicals/jammed-in
1,,史,167,1,9,"A mouth that's talking about treasure... that sounds more like ancient <radical>history</radical> to me. Just because there was treasure buried all over the place back in history, doesn't mean it wasn't found by now. Don't let history take over your life, like it has the person who owns this mouth.",History,radical,2019-12-31T06:03:47.342246Z,https://www.wanikani.com/radicals/history
2,,癶,168,2,9,"Kind of a strange <radical>tent</radical>, I'll admit, but one that will protect you from things trying to get in (that's why it has all the spikes). It's the best you can do, considering you're in a cloth/plastic building.",Tent,radical,2019-12-31T06:03:47.362947Z,https://www.wanikani.com/radicals/tent
3,,咅,175,3,9,<radical>Clown</radical>s do weird tricks. One trick they might do is stand on their mouth (or stand on someone else's mouth). Imagine a clown doing either one of these things to remember this radical: clown.,Clown,radical,2019-12-31T06:03:47.517859Z,https://www.wanikani.com/radicals/clown
4,,阝,176,4,9,"This radical looks like a curvy letter B. What does B stand for? <radical>Building</radical>! This radical is used in a lot of kanji to mark that it's a building, or that it has something to do with buildings.",Building,radical,2019-12-31T06:03:47.570118Z,https://www.wanikani.com/radicals/building
5,,辛,178,5,9,"You're standing up on top of a cross. Why? Because you ate something so <radical>spicy</radical> that it caused you to beg Jesus for mercy. You need to save your mouth from the spicy flames. To make sure he hears you, you stand up on the closest cross. Make sure to feel how spicy this is in your mouth to remember it better!",Spicy,radical,2020-01-13T20:21:55.232959Z,https://www.wanikani.com/radicals/spicy
6,,重,188,6,9,"This radical is made up of a thousand villages. If you tried to lift them, what would it be? <radical>Heavy</radical>! And probably crazy. But just remember how heavy a thousand villages would be.",Heavy,radical,2019-12-31T06:03:47.836972Z,https://www.wanikani.com/radicals/heavy
7,,反,218,7,9,This radical is the same as the kanji. It means <radical>anti</radical>.,Anti,radical,2019-12-31T06:03:48.470733Z,https://www.wanikani.com/radicals/anti
8,,聿,220,8,9,It's easier to imagine if you turn your head sideways. The left side of this radical is the <radical>brush</radical>. See all the bristles?,Brush,radical,2019-12-31T06:03:48.512893Z,https://www.wanikani.com/radicals/brush
9,,正,229,9,9,This radical is the same as the kanji. It means <radical>correct</radical>.,Correct,radical,2019-12-31T06:03:48.714117Z,https://www.wanikani.com/radicals/correct
10,,台,417,10,9,This radical is the same as the kanji. It means <radical>machine</radical>.,Machine,radical,2019-12-31T06:03:53.788078Z,https://www.wanikani.com/radicals/machine
11,,疋,420,11,9,See all the arms sticking out of this radical? Those are for hanging lots of hats and scarves and coats on because it's a <radical>coat rack</radical>.,Coat Rack,radical,2019-12-31T06:03:53.871468Z,https://www.wanikani.com/radicals/coat-rack
12,,覀,424,12,9,"This radical looks like a <radical>helicopter</radical> coming straight at you, doesn't it? You can't see the tail part because it's behind the bigger front cab of the helicopter. But you can see the windows and the big spinning blade on top from here.",Helicopter,radical,2019-12-31T06:03:53.987966Z,https://www.wanikani.com/radicals/helicopter
13,https://cdn.wanikani.com/images/1207-subject-8772-normal-weight-black-original.png?1520987992,,8772,13,9,"There's the bottom of the shoe and the spikes coming out of it. Only one kind of shoe is like this, and that is a <radical>cleat</radical>.",Cleat,radical,2019-12-31T06:08:16.872044Z,h
14,https://cdn.wanikani.com/images/1216-subject-8773-normal-weight-black-original.png?1520988029,,8773,14,9,Someone has crosses for eyes. That would have to be a really devout Catholic. Who's number one in that field? That would be the <radical>Pope</radical>.,Pope,radical,2020-01-17T08:25:53.359321Z,h
15,https://cdn.wanikani.com/images/741-subject-8779-without-css-original.svg?1520987272,,8779,15,9,"This radical looks like some new plants pushing their way up and out of the soil. That's because this is the <radical>spring</radical> radical. Spring is the season (and the radical) full of new, growing life!",Spring,radical,2019-12-31T06:08:17.109628Z,h
16,https://cdn.wanikani.com/images/1272-subject-8785-normal-weight-black-original.png?1520988190,,8785,16,9,"See the <radical>squid</radical> shape here? There's its head, its body, and its tentacles (two, anyway). Pretty squid-like if you ask me!",Squid,radical,2020-01-17T19:57:13.127212Z,h
17,https://cdn.wanikani.com/images/1212-subject-8787-normal-weight-black-original.png?1520988011,,8787,17,9,"There's a canopy with a little table and seats inside. This is a <radical>yurt</radical>! It may look like a canopy at first, but when you go inside it has a bunch of nice furniture for you to relax on.",Yurt,radical,2019-12-31T06:08:17.335948Z,h
18,https://cdn.wanikani.com/images/1435-subject-8819-normal-weight-black-original.png?1544035141,,8819,18,9,Someone shoved horns down onto your husband and said he has to fight for them now. They turned him into a <radical>gladiator</radical>! Now your husband has to fight for their amusement. Oh no!,Gladiator,radical,2019-12-31T06:08:18.392719Z,h
19,,永,8820,19,9,A drop of water will last for an <radical>eternity</radical>. Do you remember learning about the water cycle in school? A single drop of water can recycle itself this way for all eternity!,Eternity,radical,2019-12-31T06:08:18.420139Z,https://www.wanikani.com/radicals/eternity
0,,圣,179,0,10,There is a stool sticking out of the dirt. You walk up and realize it has writing on it. It's actually a <radical>tombstone</radical>. You can sit on it and remember the people who are below the dirt now.,Tombstone,radical,2020-02-03T10:55:01.241308Z,https://www.wanikani.com/radicals/tombstone
1,,各,180,1,10,"When you combine winter and mouth you get... winter mouth! Or at least a mouth that tastes like winter because it's coming in for a <radical>kiss</radical>. Before you go kissing people you eat mints, right? It's common courtesy so you don't give them a mouth full of bad breath. So when you think of a winter mouth, think of a nice, minty kiss!",Kiss,radical,2019-12-31T06:03:47.665680Z,https://www.wanikani.com/radicals/kiss
2,,豆,181,2,10,"This radical has a pod (the square in the middle) between the ground and some roots. That pod is going to turn into a plant someday. What plant will it be? Great big <radical>beans</radical>, like the ones from Jack and the Beanstalk.",Beans,radical,2019-12-31T06:03:47.687985Z,https://www.wanikani.com/radicals/beans
3,,酉,182,3,10,See the west radical on top of the mouth radical? Think of the mouth of someone from the wild west (like in a cowboy movie). What is always in their mouth? It's <radical>alcohol</radical>.,Alcohol,radical,2019-12-31T06:03:47.709892Z,https://www.wanikani.com/radicals/alcohol
4,,辰,183,4,10,If you kick a cliff you'll start a <radical>landslide</radical>! Oh no!,Landslide,radical,2020-01-24T00:36:23.796901Z,https://www.wanikani.com/radicals/landslide
5,,頁,184,5,10,"This radical consists of a shellfish with a leaf on it. What is it? The mysterious <radical>geoduck</radical>. It's a very distinct clam-like creature. If you don't know what a geoduck is, look it up. It's quite bizarre. It has a long, leaf-shaped protrusion coming out of its shell body.",Geoduck,radical,2019-12-31T06:03:47.753310Z,https://www.wanikani.com/radicals/geoduck
6,,曲,185,6,10,This radical is the same as the kanji. It means <radical>music</radical>.,Music,radical,2019-12-31T06:03:47.774308Z,https://www.wanikani.com/radicals/music
7,,丙,186,7,10,Doesn't this radical look like one of those old-fashioned <radical>dynamite</radical> plunger things that gets pushed to set the fuse? That makes this dynamite!,Dynamite,radical,2019-12-31T06:03:47.796395Z,https://www.wanikani.com/radicals/dynamite
8,,疒,187,8,10,"This is the canopy radical with ice running down the back. If you hang out in a cold canopy like this you'll definitely get <radical>sick</radical>. Imagine being sick and alone inside a cold canopy. Brrrr, oh no... ACHOO!",Sick,radical,2019-12-31T06:03:47.816669Z,https://www.wanikani.com/radicals/sick
9,,乃,200,9,10,"See the <radical>stairs</radical> shape on the right side? Also note it's being held up by a pillar or beam or something, to make sure the stairs don't just collapse as you walk up them.",Stairs,radical,2019-12-31T06:03:48.090111Z,https://www.wanikani.com/radicals/stairs
10,,束,219,10,10,"This is a tree with something wrapped around its middle, holding it tight. If you unwrapped that middle part you'd realize it's actually a bunch of trees tied in there. It's a <radical>bundle</radical> of trees!",Bundle,radical,2019-12-31T06:03:48.491018Z,https://www.wanikani.com/radicals/bundle
11,,隹,240,11,10,"This looks kind of like the top of the bird radical, but not quite. It's kind of a dumb-looking bird radical top. What's a dumb bird, so dumb that it would look into the sky to drown itself with its mouth open? A <radical>turkey</radical>.",Turkey,radical,2020-02-11T13:58:49.235437Z,https://www.wanikani.com/radicals/turkey
12,,失,275,12,10,This radical is the same as the kanji. It means <radical>fault</radical>.,Fault,radical,2019-12-31T06:03:49.880825Z,https://www.wanikani.com/radicals/fault
13,,売,439,13,10,This radical is the same as the kanji. It means <radical>sell</radical>.,Sell,radical,2019-12-31T06:03:54.477205Z,https://www.wanikani.com/radicals/sell
